Symbol,Name,Last Sale,Net Change,% Change,Market Cap,Country,IPO Year,Volume,Sector,Industry,MarketCap,Weight,Rank
RERE,ATRenew Inc. American Depositary Shares (every three of which representing two Class A ordinary shares),$1.92,0.03,1.587%,429742441.0,Cayman Islands,2021.0,317089,Consumer Discretionary,Other Specialty Stores,662888960.0,1.6334725071847598e-05,1584
NIE,Virtus Equity & Convertible Income Fund Common Shares of Beneficial Interest,$20.91,-0.2,-0.947%,579394458.0,United States,2007.0,65402,Finance,Investment Managers,659751296.0,1.6257407629710934e-05,1585
BOE,Blackrock Enhanced Global Dividend Trust Common Shares of Beneficial Interest,$9.92,-0.1,-0.998%,0.0,United States,2005.0,528357,Finance,Trusts Except Educational Religious and Charitable,656235392.0,1.617076970287171e-05,1586
CION,CION Investment Corporation Common Stock,$11.31,-0.13,-1.136%,614127198.0,United States,2021.0,206229,Finance,Finance/Investors Services,652752256.0,1.608493923595934e-05,1587
BORR,Borr Drilling Limited Common Shares,$7.36,0.0,0.00%,1871353600.0,,2019.0,1180538,Energy,Oil & Gas Production,644158080.0,1.5873163945299694e-05,1588
MEGI,MainStay CBRE Global Infrastructure Megatrends Term Fund Common Shares,$12.98,-0.11,-0.84%,0.0,United States,2021.0,389013,Finance,Investment Managers,643827584.0,1.5865019954943684e-05,1589
ODC,Oil-Dri Corporation Of America Common Stock,$67.08,-2.09,-3.022%,489873166.0,United States,,76356,Consumer Discretionary,Miscellaneous manufacturing industries,637049920.0,1.5698006646908868e-05,1590
VVR,Invesco Senior Income Trust Common Stock (DE),$4.10,-0.06,-1.442%,0.0,United States,1998.0,1519728,Finance,Trusts Except Educational Religious and Charitable,633992128.0,1.562265738834391e-05,1591
PDT,John Hancock Premium Dividend Fund,$10.65,0.02,0.188%,0.0,United States,,252161,Finance,Finance Companies,631537984.0,1.5562183055618977e-05,1592
PLOW,Douglas Dynamics Inc. Common Stock,$29.68,-0.73,-2.401%,682164081.0,United States,2010.0,135013,Industrials,Construction/Ag Equipment/Trucks,630697152.0,1.5541463507730277e-05,1593
MHD,Blackrock MuniHoldings Fund Inc. Common Stock,$11.91,0.07,0.591%,1771761030.0,United States,1997.0,407144,Finance,Investment Bankers/Brokers/Service,627784832.0,1.5469698929660906e-05,1594
NDMO,Nuveen Dynamic Municipal Opportunities Fund Common Shares of Beneficial Interest,$9.91,0.01,0.101%,589300469.0,,2020.0,710354,Finance,Trusts Except Educational Religious and Charitable,627189952.0,1.5455040062434124e-05,1595
XPOF,Xponential Fitness Inc. Class A Common Stock,$12.89,-0.03,-0.232%,611721568.0,United States,2021.0,672779,Consumer Discretionary,Services-Misc. Amusement & Recreation,625523840.0,1.5413984194707943e-05,1596
YALA,Yalla Group Limited American Depositary Shares each representing one Class A Ordinary Share,$6.13,0.02,0.327%,957742520.0,United Arab Emirates,2020.0,953481,Technology,Computer Software: Programming Data Processing,624355136.0,1.5385185316340184e-05,1597
SMP,Standard Motor Products Inc. Common Stock,$39.81,-0.4,-0.995%,865043115.0,United States,,93421,Consumer Discretionary,Auto Parts:O.E.M.,622112320.0,1.5329918469315396e-05,1598
VEL,Velocity Financial Inc. Common Stock,$17.22,0.69,4.174%,564505455.0,United States,2020.0,133529,Finance,Finance: Consumer Services,620240192.0,1.528378601271315e-05,1599
ASPN,Aspen Aerogels Inc. Common Stock,$15.78,-0.22,-1.375%,1108654292.0,United States,2014.0,1190170,Consumer Discretionary,RETAIL: Building Materials,619457088.0,1.5264488982117463e-05,1600
MUJ,Blackrock MuniHoldings New Jersey Quality Fund Inc. Common Stock,$11.41,-0.02,-0.175%,1697379794.0,United States,1998.0,270998,Finance,Investment Bankers/Brokers/Service,618010880.0,1.5228851927494157e-05,1601
CURV,Torrid Holdings Inc. Common Stock,$5.77,0.0,0.00%,600672787.0,,2021.0,73134,Consumer Discretionary,Clothing/Shoe/Accessory Stores,617018688.0,1.520440260865426e-05,1602
UVE,UNIVERSAL INSURANCE HOLDINGS INC Common Stock,$15.98,-0.02,-0.125%,466389212.0,United States,,190444,Finance,Property-Casualty Insurers,616426240.0,1.5189803670093924e-05,1603
MAX,MediaAlpha Inc. Class A Common Stock,$11.15,-0.46,-3.962%,725743454.0,United States,2020.0,53915,Industrials,Industrial Machinery/Components,614812544.0,1.5150039422836676e-05,1604
GNK,Genco Shipping & Trading Limited Ordinary Shares New (Marshall Islands),$16.59,0.11,0.667%,705716452.0,United States,,651234,Consumer Discretionary,Marine Transportation,614003456.0,1.5130102101752115e-05,1605
NMCO,Nuveen Municipal Credit Opportunities Fund Common Shares,$9.97,0.06,0.605%,546071596.0,,2019.0,554176,Finance,Finance/Investors Services,612137216.0,1.5084114735605475e-05,1606
NKX,Nuveen California AMT-Free Quality Municipal Income Fund,$11.54,0.06,0.523%,0.0,United States,2002.0,173446,Finance,Finance/Investors Services,609262848.0,1.5013285360146701e-05,1607
NGL,NGL ENERGY PARTNERS LP Common Units representing Limited Partner Interests,$5.57,0.11,2.015%,734835301.0,United States,2011.0,666220,Utilities,Natural Gas Distribution,607259776.0,1.4963926217977375e-05,1608
LDP,Cohen & Steers Limited Duration Preferred and Income Fund Inc.,$18.43,-0.22,-1.18%,0.0,United States,2012.0,288106,Finance,Finance Companies,605138112.0,1.4911644764783712e-05,1609
CSV,Carriage Services Inc. Common Stock,$25.01,-0.28,-1.107%,374686290.0,United States,,70027,Consumer Discretionary,Other Consumer Services,604052608.0,1.4884896077636485e-05,1610
HOV,Hovnanian Enterprises Inc. Class A Common Stock,$155.62,-2.09,-1.325%,948515260.0,United States,1983.0,65576,Consumer Discretionary,Homebuilding,604012992.0,1.488391987120148e-05,1611
LAC,Lithium Americas Corp. Common Shares,$6.40,-0.2,-3.03%,1027200000.0,Canada,2023.0,2777881,Basic Materials,Metal Mining,601556032.0,1.4823376147389083e-05,1612
YRD,Yiren Digital Ltd. American Depositary Shares each representing two ordinary shares,$3.12,0.03,0.971%,278581318.0,China,2015.0,128500,Finance,Finance: Consumer Services,599848000.0,1.4781287298701788e-05,1613
ETJ,Eaton Vance Risk-Managed Diversified Equity Income Fund Common Shares of Beneficial Interest,$7.84,0.05,0.642%,0.0,United States,2007.0,347164,Finance,Finance Companies,599659008.0,1.4776630210490847e-05,1614
CTO,CTO Realty Growth Inc. Common Stock,$17.33,-0.29,-1.646%,393156075.0,United States,1992.0,128051,Real Estate,Real Estate Investment Trusts,595138240.0,1.4665230704918139e-05,1615
KOP,Koppers Holdings Inc. Common Stock,$51.22,-0.78,-1.50%,1066557441.0,United States,2006.0,91936,Basic Materials,Forest Products,592865344.0,1.4609222634913621e-05,1616
CCO,Clear Channel Outdoor Holdings Inc. Common Stock,$1.82,-0.06,-3.191%,879077869.0,United States,2005.0,1479388,Consumer Discretionary,Advertising,588069632.0,1.449104803589215e-05,1617
AXL,American Axle & Manufacturing Holdings Inc. Common Stock,$8.81,-0.07,-0.788%,1031307833.0,United States,,691346,Consumer Discretionary,Auto Parts:O.E.M.,587905024.0,1.4486991811415841e-05,1618
GMRE,Global Medical REIT Inc. Common Stock,$11.10,-0.29,-2.546%,727770867.0,United States,2016.0,317955,Real Estate,Real Estate Investment Trusts,585552448.0,1.4429020289050125e-05,1619
IIM,Invesco Value Municipal Income Trust Common Stock,$11.73,0.08,0.687%,552112789.0,United States,,254621,Finance,Investment Managers,585530880.0,1.4428488816402957e-05,1620
MCS,Marcus Corporation (The) Common Stock,$14.58,-0.11,-0.749%,462124093.0,United States,,230176,Consumer Discretionary,Movies/Entertainment,583676288.0,1.4382788477027192e-05,1621
PEO,Adams Natural Resources Fund Inc. Common Stock,$20.63,-0.06,-0.29%,0.0,United States,,34685,Finance,Finance/Investors Services,583255296.0,1.4372414509451313e-05,1622
SMBK,SmartFinancial Inc. Common Stock,$24.49,-0.51,-2.04%,416196358.0,United States,,17990,Finance,Major Banks,582921088.0,1.4364179049025465e-05,1623
GCI,Gannett Co. Inc. Common Stock,$2.30,-0.14,-5.738%,342414984.0,United States,2014.0,984237,Consumer Discretionary,Newspapers/Magazines,580633856.0,1.4307817715302948e-05,1624
ZKH,ZKH Group Limited American Depositary Shares each representing thirty-five (35) Class A Ordinary Shares,$16.31,0.19,1.179%,2619614797.0,,2023.0,40181,,,579978816.0,1.4291676402116705e-05,1625
HZO,MarineMax Inc.  (FL) Common Stock,$38.90,-0.31,-0.791%,862457385.0,United States,1998.0,279532,Consumer Discretionary,Auto & Home Supply Stores,579717376.0,1.4285234070473734e-05,1626
BHK,Blackrock Core Bond Trust,$10.91,-0.05,-0.456%,0.0,United States,2001.0,179560,Finance,Finance Companies,578005888.0,1.424306005999728e-05,1627
PACK,Ranpak Holdings Corp Class A Common Stock,$5.82,-0.23,-3.802%,480762666.0,United States,2018.0,386087,Consumer Discretionary,Containers/Packaging,571886912.0,1.4092277958148375e-05,1628
PML,Pimco Municipal Income Fund II Common Shares of Beneficial Interest,$8.30,0.03,0.363%,0.0,United States,2002.0,675864,Finance,Investment Managers,571186240.0,1.4075012193931181e-05,1629
MMU,Western Asset Managed Municipals Fund Inc. Common Stock,$10.17,0.13,1.295%,0.0,United States,1992.0,393227,Finance,Investment Managers,570766464.0,1.4064668190688526e-05,1630
EMD,Western Asset Emerging Markets Debt Fund Inc Common Stock,$9.21,-0.14,-1.497%,0.0,United States,,349790,Finance,Finance/Investors Services,569240640.0,1.402706926077419e-05,1631
BIT,BlackRock Multi-Sector Income Trust Common Shares of Beneficial Interest,$15.00,-0.15,-0.99%,0.0,,2013.0,317602,Finance,Trusts Except Educational Religious and Charitable,566987200.0,1.3971540620101243e-05,1632
OLP,One Liberty Properties Inc. Common Stock,$21.91,-0.41,-1.837%,461549290.0,United States,1986.0,58898,Real Estate,Real Estate Investment Trusts,564619456.0,1.3913195332105322e-05,1633
IFN,India Fund Inc. (The) Common Stock,$18.29,0.03,0.164%,0.0,United States,,82135,Finance,Finance/Investors Services,562076672.0,1.3850536757195441e-05,1634
ZIP,ZipRecruiter Inc. Class A Common Stock,$13.90,-0.25,-1.767%,1373781230.0,United States,2021.0,437383,Consumer Discretionary,Diversified Commercial Services,561541760.0,1.3837355604717608e-05,1635
VKQ,Invesco Municipal Trust Common Stock,$9.53,0.08,0.847%,527347458.0,United States,,418809,Finance,Trusts Except Educational Religious and Charitable,555568448.0,1.36901629145748e-05,1636
VGM,Invesco Trust for Investment Grade Municipals Common Stock (DE),$9.89,0.08,0.815%,536354164.0,United States,,487398,Finance,Trusts Except Educational Religious and Charitable,555335680.0,1.3684427110367827e-05,1637
KODK,Eastman Kodak Company Common New,$3.90,-0.14,-3.465%,310256567.0,United States,,750220,Consumer Discretionary,Business Services,553955968.0,1.3650428631650775e-05,1638
UHT,Universal Health Realty Income Trust Common Stock,$43.25,-0.92,-2.083%,597847042.0,United States,,57230,Real Estate,Real Estate Investment Trusts,552777472.0,1.3621388461547064e-05,1639
TK,Teekay Corporation Common Stock,$7.15,-0.06,-0.832%,686595338.0,Bermuda,,535917,Consumer Discretionary,Marine Transportation,551433600.0,1.3588273142125008e-05,1640
BGB,Blackstone Strategic Credit 2027 Term Fund Common Shares of Beneficial Interest,$11.32,0.02,0.177%,0.0,United States,2012.0,204904,Finance,Trusts Except Educational Religious and Charitable,550265408.0,1.3559486880318609e-05,1641
EBF,Ennis Inc. Common Stock,$21.91,-0.08,-0.364%,566914655.0,United States,,71417,Consumer Discretionary,Office Equipment/Supplies/Services,549386112.0,1.3537819513257956e-05,1642
BGS,B&G Foods Inc. Common Stock,$10.50,-0.16,-1.501%,825556400.0,United States,,1120076,Consumer Staples,Packaged Foods,549219136.0,1.353370493718537e-05,1643
DIAX,Nuveen Dow 30SM Dynamic Overwrite Fund Common Shares of Beneficial Interest,$14.00,-0.08,-0.568%,0.0,,2014.0,183438,Finance,Finance Companies,547321856.0,1.3486952692006457e-05,1644
FPI,Farmland Partners Inc. Common Stock,$12.48,-0.46,-3.555%,601360644.0,United States,2014.0,363561,Real Estate,Real Estate Investment Trusts,546804288.0,1.3474198925544596e-05,1645
USNA,USANA Health Sciences Inc. Common Stock,$53.60,-0.45,-0.833%,1025357602.0,United States,,52237,Health Care, Medicinal Chemicals and Botanical Products ,545866944.0,1.345110115584008e-05,1646
IVR,INVESCO MORTGAGE CAPITAL INC Common Stock,$8.86,-0.22,-2.423%,429361146.0,United States,2009.0,1295225,Real Estate,Real Estate Investment Trusts,544455936.0,1.3416331489810075e-05,1647
IIIN,Insteel Industries Inc. Common Stock,$38.29,-0.59,-1.517%,744903233.0,United States,,108223,Industrials,Steel/Iron Ore,543279552.0,1.338734336302196e-05,1648
GES,Guess? Inc. Common Stock,$23.06,-0.34,-1.453%,1238328780.0,United States,1996.0,595006,Consumer Discretionary,Apparel,541325568.0,1.333919383367275e-05,1649
FTHY,First Trust High Yield Opportunities 2027 Term Fund Common Stock,$13.93,-0.05,-0.358%,512247737.0,United States,2020.0,166100,Finance,Investment Managers,541298560.0,1.3338528310061162e-05,1650
GHY,PGIM Global High Yield Fund Inc.,$11.36,-0.1,-0.873%,0.0,United States,2012.0,189982,Finance,Trusts Except Educational Religious and Charitable,541013952.0,1.3331515079016782e-05,1651
BBW,Build-A-Bear Workshop Inc. Common Stock,$22.99,-0.03,-0.13%,328887813.0,United States,2004.0,423884,Consumer Discretionary,Recreational Games/Products/Toys,539477568.0,1.3293655932524457e-05,1652
CAL,Caleres Inc. Common Stock,$30.73,-0.94,-2.968%,1090982606.0,United States,,327365,Consumer Discretionary,Shoe Manufacturing,538738176.0,1.327543604085463e-05,1653
NPWR,NET Power Inc. Class A Common Stock,$10.10,-0.49,-4.627%,2151959884.0,,2021.0,195842,Energy,Industrial Machinery/Components,537273536.0,1.3239344790022469e-05,1654
VCV,Invesco California Value Municipal Income Trust Common Stock,$9.80,0.02,0.204%,469327145.0,United States,,264732,Finance,Trusts Except Educational Religious and Charitable,534457984.0,1.316996474204959e-05,1655
IQI,Invesco Quality Municipal Income Trust Common Stock,$9.51,0.05,0.529%,502924909.0,United States,,224989,Finance,Finance Companies,531482208.0,1.3096636498907027e-05,1656
OMI,Owens & Minor Inc. Common Stock,$19.27,-0.32,-1.633%,1474175099.0,United States,,660722,Health Care,Medical Specialities,531280992.0,1.3091678190293685e-05,1657
WIW,Western Asset Inflation-Linked Opportunities & Income Fund,$8.67,-0.01,-0.115%,0.0,United States,2004.0,310483,Finance,Finance Companies,531078016.0,1.3086676512250678e-05,1658
QD,Qudian Inc. American Depositary Shares each representing one Class A Ordinary Share,$2.04,-0.05,-2.392%,473782505.0,China,2017.0,763224,Finance,Finance: Consumer Services,530331200.0,1.3068273680441175e-05,1659
CHCT,Community Healthcare Trust Incorporated Common Stock,$26.64,-0.46,-1.697%,726324841.0,United States,2015.0,127103,Real Estate,Real Estate Investment Trusts,529946816.0,1.305880179700233e-05,1660
NVRI,Enviri Corporation Common Stock,$9.00,-0.01,-0.111%,718502175.0,United States,,544721,Miscellaneous,Diversified Commercial Services,529305472.0,1.3042997976832388e-05,1661
LXU,LSB Industries Inc. Common Stock,$9.31,-0.15,-1.586%,692145768.0,United States,2003.0,503186,Industrials,Major Chemicals,528563744.0,1.3024720522101372e-05,1662
BGY,Blackrock Enhanced International Dividend Trust,$5.27,-0.05,-0.94%,0.0,United States,2007.0,533693,Finance,Trusts Except Educational Religious and Charitable,523240416.0,1.2893544556601406e-05,1663
AVK,Advent Convertible and Income Fund,$11.38,-0.12,-1.043%,0.0,United States,2003.0,195471,Finance,Trusts Except Educational Religious and Charitable,522720608.0,1.2880735592683606e-05,1664
ASGI,abrdn Global Infrastructure Income Fund Common Shares of Beneficial Interest,$17.94,0.08,0.448%,0.0,,2020.0,90160,Finance,Investment Managers,519837792.0,1.280969804396244e-05,1665
BME,Blackrock Health Sciences Trust,$40.46,0.75,1.889%,539453908.0,United States,2005.0,88690,Finance,Trusts Except Educational Religious and Charitable,516964000.0,1.2738882862135192e-05,1666
LDI,loanDepot Inc. Class A Common Stock,$3.52,-0.12,-3.297%,1130158005.0,United States,2021.0,560571,Finance,Finance: Consumer Services,516661568.0,1.273143041704857e-05,1667
KIO,KKR Income Opportunities Fund Common Shares,$12.57,0.06,0.48%,0.0,,2013.0,120368,Finance,Investment Managers,516468320.0,1.2726668453671348e-05,1668
NAT,Nordic American Tankers Limited Common Stock,$4.20,-0.03,-0.709%,876960000.0,Bermuda,1995.0,2679153,Consumer Discretionary,Marine Transportation,513638176.0,1.2656928833699794e-05,1669
BLE,BlackRock Municipal Income Trust II,$10.68,0.04,0.376%,0.0,United States,2002.0,206991,Finance,Finance/Investors Services,513066336.0,1.2642837711734079e-05,1670
GUG,Guggenheim Active Allocation Fund Common Shares of Beneficial Interest,$14.66,-0.05,-0.34%,0.0,United States,2021.0,82977,Finance,Trusts Except Educational Religious and Charitable,510531936.0,1.258038573301642e-05,1671
STK,Columbia Seligman Premium Technology Growth Fund Inc,$31.60,-0.31,-0.971%,0.0,United States,2009.0,29508,Finance,Investment Managers,509598656.0,1.2557388107267676e-05,1672
BLW,Blackrock Limited Duration Income Trust,$13.98,0.2,1.451%,499243317.0,United States,2003.0,260015,Consumer Discretionary,Other Consumer Services,508867808.0,1.2539378754465498e-05,1673
BUI,BlackRock Utility Infrastructure & Power Opportunities Trust,$21.82,0.14,0.646%,0.0,United States,2011.0,56354,Finance,Trusts Except Educational Religious and Charitable,507944064.0,1.251661611217203e-05,1674
TTI,Tetra Technologies Inc. Common Stock,$4.52,-0.03,-0.659%,587957862.0,United States,,1312841,Energy,Oil & Gas Production,507069024.0,1.2495053620277656e-05,1675
RYAM,Rayonier Advanced Materials Inc. Common Stock,$4.05,-0.03,-0.735%,264640843.0,United States,2014.0,432181,Basic Materials,Paper,503596704.0,1.2409489678223957e-05,1676
NXJ,Nuveen New Jersey Qualified Municipal Fund ,$11.78,-0.02,-0.169%,0.0,United States,2001.0,245263,Finance,Finance/Investors Services,503453696.0,1.2405965714929901e-05,1677
DNA,Ginkgo Bioworks Holdings Inc. Class A Common Stock,$1.69,-0.08,-4.52%,3580157780.0,United States,2021.0,18258694,Health Care,Biotechnology: Biological Products (No Diagnostic Substances),501410336.0,1.2355613807088789e-05,1678
DSU,Blackrock Debt Strategies Fund Inc. Common Stock,$10.79,-0.06,-0.553%,0.0,United States,1998.0,298052,Finance,Finance Companies,500625408.0,1.2336271829993265e-05,1679
TWI,Titan International Inc. (DE) Common Stock,$14.88,-0.13,-0.866%,920919897.0,United States,,277528,Industrials,Steel/Iron Ore,500525792.0,1.2333817120274225e-05,1680
PBT,Permian Basin Royalty Trust Common Stock,$13.96,-0.12,-0.852%,650658792.0,United States,,300127,Energy,Oil & Gas Production,499180256.0,1.2300660797027759e-05,1681
JELD,JELD-WEN Holding Inc. Common Stock,$18.88,-0.31,-1.615%,1608860824.0,United States,2017.0,313899,Basic Materials,Forest Products,497221024.0,1.2252381947924635e-05,1682
WNC,Wabash National Corporation Common Stock,$25.62,-0.12,-0.466%,1180756703.0,United States,1991.0,438338,Industrials,Construction/Ag Equipment/Trucks,495389184.0,1.2207242256994178e-05,1683
AGS,PlayAGS Inc. Common Stock,$8.43,-0.23,-2.656%,326343880.0,United States,2018.0,280656,Consumer Discretionary,Miscellaneous manufacturing industries,495214304.0,1.2202932912755642e-05,1684
MYD,Blackrock MuniYield Fund Inc.  Common Stock,$10.78,0.06,0.56%,1603659437.0,United States,1991.0,199825,Finance,Investment Bankers/Brokers/Service,494836448.0,1.21936218904741e-05,1685
CPAC,Cementos Pacasmayo S.A.A. American Depositary Shares (Each representing five Common Shares),$5.14,0.02,0.391%,435736767.0,Peru,,13490,Industrials,Building Materials,494230656.0,1.2178694132783393e-05,1686
AMBC,Ambac Financial Group Inc. Common Stock,$16.48,0.06,0.365%,744805970.0,United States,,319402,Finance,Property-Casualty Insurers,493408224.0,1.2158427992568462e-05,1687
VHI,Valhi Inc. Common Stock,$15.19,-0.45,-2.877%,429702209.0,United States,,3717,Industrials,Major Chemicals,488368256.0,1.2034234505244567e-05,1688
XYF,X Financial American Depositary Shares each representing six Class A Ordinary Shares,$3.66,-0.03,-0.813%,175630326.0,Cayman Islands,2018.0,7265,Finance,Finance: Consumer Services,488153920.0,1.202895289724645e-05,1689
HPS,John Hancock Preferred Income Fund III Preferred Income Fund III,$14.14,0.05,0.355%,0.0,United States,2003.0,147151,Finance,Investment Managers,487300576.0,1.2007925032139583e-05,1690
HKD,AMTD Digital Inc. American Depositary Shares (every five of which represent two Class A Ordinary Shares),$4.17,-0.07,-1.651%,798327135.0,,2022.0,524154,Finance,Finance: Consumer Services,482278944.0,1.188418337541929e-05,1691
NOA,North American Construction Group Ltd. Common Shares (no par),$20.85,-0.03,-0.144%,557540843.0,Canada,2006.0,32807,Energy,Oilfield Services/Equipment,480061376.0,1.1829538682576425e-05,1692
GFR,Greenfire Resources Ltd. Common Shares,$4.86,-0.33,-6.358%,0.0,Canada,,25304,,,478194016.0,1.1783523717701817e-05,1693
HPP,Hudson Pacific Properties Inc. Common Stock,$9.31,-0.16,-1.69%,1312130006.0,United States,2010.0,2504736,Finance,Real Estate,477152000.0,1.1757846649734859e-05,1694
NBB,Nuveen Taxable Municipal Income Fund Common Shares of Beneficial Interest,$15.79,0.03,0.19%,0.0,United States,2010.0,343743,Finance,Finance Companies,475019968.0,1.1705309711173713e-05,1695
DDD,3D Systems Corporation Common Stock,$6.35,-0.29,-4.367%,847306211.0,United States,,1450631,Technology,Computer Software: Prepackaged Software,473313792.0,1.1663266597521338e-05,1696
ISD,PGIM High Yield Bond Fund Inc.,$12.32,-0.09,-0.725%,0.0,United States,2012.0,142797,Finance,Trusts Except Educational Religious and Charitable,473242816.0,1.166151762670321e-05,1697
WDH,Waterdrop Inc. American Depositary Shares (each representing the right to receive 10 Class A Ordinary Shares),$1.04,-0.01,-0.952%,406634349.0,Cayman Islands,2021.0,206061,Finance,Specialty Insurers,472243200.0,1.1636885367723637e-05,1698
NLOP,Net Lease Office Properties Common Shares of Beneficial Interest,$18.48,-0.1,-0.538%,270194583.0,United States,2023.0,115850,,,469128032.0,1.15601222657516e-05,1699
RMT,Royce Micro-Cap Trust Inc. Common Stock,$9.24,-0.07,-0.752%,427526549.0,United States,,121539,Finance,Investment Managers,466782144.0,1.150231554721861e-05,1700
ASA,ASA  Gold and Precious Metals Limited,$15.06,-0.23,-1.504%,290505969.0,United States,,138059,Industrials,Precious Metals,465494528.0,1.1470586472475667e-05,1701
PNNT,PennantPark Investment Corporation Common Stock,$6.91,-0.03,-0.432%,450701295.0,United States,2022.0,270204,Finance,Finance/Investors Services,464255264.0,1.1440048874245885e-05,1702
CYH,Community Health Systems Inc. Common Stock,$3.13,-0.09,-2.795%,428186858.0,United States,2000.0,1443609,Health Care,Hospital/Nursing Management,464002848.0,1.1433828909496833e-05,1703
TYG,Tortoise Energy Infrastructure Corporation Common Stock,$28.77,-0.17,-0.587%,343165769.0,United States,2004.0,66178,Finance,Investment Managers,462890688.0,1.1406423372623952e-05,1704
HPI,John Hancock Preferred Income Fund Common Shares of Beneficial Interest,$15.78,0.21,1.349%,0.0,United States,2002.0,190068,Finance,Trusts Except Educational Religious and Charitable,459664928.0,1.1326935093398781e-05,1705
THW,abrdn World Healthcare Fund Shares of Beneficial Interest,$11.67,-0.08,-0.681%,0.0,United States,2015.0,205544,Finance,Finance Companies,458750272.0,1.1304396395069401e-05,1706
FRA,Blackrock Floating Rate Income Strategies Fund Inc  Common Stock,$12.66,0.05,0.397%,1883332883.0,United States,2003.0,166953,Finance,Investment Bankers/Brokers/Service,458018592.0,1.1286366540355017e-05,1707
GBLI,Global Indemnity Group LLC Class A Common Stock (DE),$32.24,0.49,1.543%,436611651.0,Ireland,,31484,Finance,Property-Casualty Insurers,457253280.0,1.1267507935266488e-05,1708
ECCX,Eagle Point Credit Company Inc. 6.6875% Notes due 2028,$24.0503,0.1003,0.419%,1458951901.0,United States,2022.0,3130,Finance,Trusts Except Educational Religious and Charitable,455523840.0,1.1224891556607449e-05,1709
CMP,Compass Minerals Intl Inc Common Stock,$25.32,-0.8,-3.063%,1043438238.0,United States,2003.0,329801,Basic Materials,Other Metals and Minerals,454054848.0,1.1188693065003752e-05,1710
GNTY,Guaranty Bancshares Inc. Common Stock,$33.62,0.1,0.298%,387614864.0,United States,,10047,Finance,Major Banks,453773216.0,1.1181753167722261e-05,1711
LVWR,LiveWire Group Inc. Common Stock,$11.31,0.03,0.266%,2290769790.0,United States,2022.0,25322,,,453749280.0,1.1181163343478817e-05,1712
NPFD,Nuveen Variable Rate Preferred & Income Fund Common Shares,$16.25,-0.02,-0.123%,0.0,,2021.0,168405,Finance,Trusts Except Educational Religious and Charitable,453318528.0,1.117054887270207e-05,1713
SNDA,Sonida Senior Living Inc. Common Stock,$9.6601,-0.0659,-0.678%,78998810.0,United States,,837,Health Care,Hospital/Nursing Management,450814784.0,1.1108852310595667e-05,1714
SGU,Star Group L.P. Common Stock,$11.53,-0.52,-4.315%,410343545.0,United States,,58383,Consumer Discretionary,Other Specialty Stores,449372288.0,1.10733067260422e-05,1715
BFK,BlackRock Municipal Income Trust,$10.07,0.01,0.099%,0.0,United States,,233111,Finance,Finance Companies,447318944.0,1.1022708795254625e-05,1716
BKSY,BlackSky Technology Inc. Class A Common Stock,$1.40,-0.12,-7.895%,200182504.0,United States,2019.0,735305,Technology,Radio And Television Broadcasting And Communications Equipment,445370688.0,1.0974700413685594e-05,1717
BOC,Boston Omaha Corporation Class A Common Stock,$15.73,-0.23,-1.441%,492427697.0,United States,2022.0,146489,Finance,Real Estate,444372128.0,1.095009417636382e-05,1718
MVF,Blackrock MuniVest Fund Inc. Common Stock,$7.12,0.08,1.136%,1059188794.0,United States,1988.0,249645,Finance,Investment Bankers/Brokers/Service,440290016.0,1.084950390973381e-05,1719
DPG,Duff & Phelps Utility and Infrastructure Fund Inc.,$9.17,-0.03,-0.326%,0.0,United States,2011.0,268919,Finance,Trusts Except Educational Religious and Charitable,439990528.0,1.0842124009874991e-05,1720
