Symbol,Name,Last Sale,Net Change,% Change,Market Cap,Country,IPO Year,Volume,Sector,Industry,MarketCap,Weight,Rank
CNM,Core & Main Inc. Class A Common Stock,$40.41,-0.19,-0.468%,8737639885.0,United States,2021.0,1387043,Consumer Discretionary,Durable Goods,10140269568.0,0.0002498736976215486,579
EHC,Encompass Health Corporation Common Stock,$66.72,-0.52,-0.773%,6688065909.0,United States,,431833,Health Care,Hospital/Nursing Management,10109254656.0,0.00024910943680078073,580
IPG,Interpublic Group of Companies Inc. (The) Common Stock,$32.64,-0.3,-0.911%,12501254836.0,United States,,2954350,Consumer Discretionary,Advertising,10065249280.0,0.00024802506858526043,581
SSB,SouthState Corporation Common Stock,$84.45,-1.37,-1.596%,6423711038.0,United States,,364247,Finance,Major Banks,10063516672.0,0.000247982374141628,582
MTZ,MasTec Inc. Common Stock,$75.72,0.13,0.172%,5968486495.0,United States,,722628,Industrials,Water Sewer Pipeline Comm & Power Line Construction,10049375232.0,0.00024763390471694484,583
KNSL,Kinsale Capital Group Inc. Common Stock,$334.91,-0.33,-0.098%,7761026168.0,United States,,172103,Finance,Property-Casualty Insurers,9964356608.0,0.0002455388994704752,584
NIO,NIO Inc. American depositary shares each  representing one Class A ordinary share,$9.07,-0.36,-3.818%,15592288518.0,United States,2018.0,74557849,Finance,Finance Companies,9950027776.0,0.00024518581238433534,585
CRS,Carpenter Technology Corporation Common Stock,$70.80,-0.75,-1.048%,3490893332.0,United States,,234262,Industrials,Steel/Iron Ore,9915296768.0,0.0002443299805612377,586
MGM,MGM Resorts International Common Stock,$44.68,-0.37,-0.821%,15261945463.0,United States,,2634016,Consumer Discretionary,Hotels/Resorts,9900052480.0,0.0002439543350633913,587
NVT,nVent Electric plc Ordinary Shares ,$59.09,-0.2,-0.337%,9803728498.0,United Kingdom,2018.0,914332,Industrials,Industrial Machinery/Components,9889768448.0,0.0002437009188119725,588
UWMC,UWM Holdings Corporation Class A Common Stock,$7.15,-0.07,-0.97%,11409427000.0,United States,,1397035,Finance,Finance: Consumer Services,9868569600.0,0.00024317854270554303,589
BG,Bunge Limited Common Shares,$100.95,-0.67,-0.659%,14666821379.0,United States,,745773,Consumer Staples,Packaged Foods,9813155840.0,0.00024181305226986382,590
STN,Stantec Inc Common Stock,$80.19,0.26,0.325%,8897765724.0,Canada,,54661,Consumer Discretionary,Military/Government/Technical,9719211008.0,0.0002394980898926945,591
PAC,Grupo Aeroportuario Del Pacifico S.A. B. de C.V. Grupo Aeroportuario Del Pacifico S.A. de C.V. (each representing 10 Series B shares),$175.22,0.99,0.568%,8853471654.0,Mexico,2006.0,49568,Consumer Discretionary,Aerospace,9710238720.0,0.00023927699727147261,592
ATR,AptarGroup Inc. Common Stock,$123.62,-1.58,-1.262%,8131880474.0,United States,,313527,Health Care,Medical/Dental Instruments,9683710976.0,0.00023862330799443842,593
CUBE,CubeSmart Common Shares,$46.35,-1.08,-2.277%,10422305774.0,United States,,1182743,Real Estate,Real Estate Investment Trusts,9670683648.0,0.0002383022922072683,594
ARMK,Aramark Common Stock,$28.10,0.1,0.357%,7348388541.0,United States,2013.0,1846007,Consumer Discretionary,Restaurants,9665727488.0,0.00023818016389333155,595
REXR,Rexford Industrial Realty Inc. Common Stock,$56.10,-0.88,-1.544%,11842559596.0,United States,2013.0,1078723,Real Estate,Real Estate Investment Trusts,9642389504.0,0.0002376050757935521,596
ORI,Old Republic International Corporation Common Stock,$29.40,-0.04,-0.136%,8243104468.0,United States,,844286,Finance,Property-Casualty Insurers,9594596352.0,0.000236427370257112,597
WBS,Webster Financial Corporation Common Stock,$50.76,-0.82,-1.59%,8732499849.0,United States,,718558,Finance,Major Banks,9587612672.0,0.0002362552803602011,598
AGI,Alamos Gold Inc. Class A Common Shares,$13.47,-0.12,-0.883%,5338399338.0,Canada,2015.0,2073666,Basic Materials,Precious Metals,9584505856.0,0.0002361787230658862,599
VFC,V.F. Corporation Common Stock,$18.80,-0.26,-1.364%,7311007995.0,United States,,5537302,Consumer Discretionary,Apparel,9579599872.0,0.00023605783117496245,600
WAL,Western Alliance Bancorporation Common Stock (DE),$65.79,-1.41,-2.098%,7202274920.0,United States,2005.0,973462,Finance,Major Banks,9516717056.0,0.00023450829034220582,601
PRI,Primerica Inc. Common Stock,$205.76,-0.59,-0.286%,7208589667.0,United States,2010.0,74904,Finance,Life Insurance,9486771200.0,0.0002337703729015516,602
EDR,Endeavor Group Holdings Inc. Class A Common Stock,$23.73,-0.06,-0.252%,16467085239.0,United States,2021.0,1266572,Consumer Discretionary,Services-Misc. Amusement & Recreation,9479493632.0,0.00023359104109842174,603
AOS,A.O. Smith Corporation Common Stock,$82.44,0.2,0.243%,12260512084.0,United States,,610917,Industrials,Industrial Machinery/Components,9464302592.0,0.0002332167077229565,604
DTM,DT Midstream Inc. Common Stock ,$54.80,-0.14,-0.255%,5314011951.0,United States,2021.0,403540,Utilities,Oil & Gas Production,9419291648.0,0.00023210756058093088,605
CX,Cemex S.A.B. de C.V. Sponsored ADR,$7.75,-0.14,-1.774%,11401422358.0,Mexico,,4935684,Industrials,Building Materials,9393549312.0,0.00023147322510901847,606
AIT,Applied Industrial Technologies Inc. Common Stock,$172.69,-1.47,-0.844%,6693465954.0,United States,,132338,Consumer Discretionary,Industrial Specialties,9390157824.0,0.00023138965300658905,607
HESM,Hess Midstream LP Class A Share,$31.63,-0.03,-0.095%,2162179134.0,United States,2017.0,513430,Energy,Oil & Gas Production,9383663616.0,0.00023122962454233555,608
EGP,EastGroup Properties Inc. Common Stock,$183.54,-1.46,-0.789%,8503485470.0,United States,,263034,Real Estate,Real Estate Investment Trusts,9363800064.0,0.0002307401524279254,609
BWXT,BWX Technologies Inc. Common Stock,$76.73,0.14,0.183%,7021776223.0,United States,,513746,Industrials,Industrial Machinery/Components,9343229952.0,0.00023023326945884244,610
EVR,Evercore Inc. Class A Common Stock,$171.05,-2.05,-1.184%,6443901138.0,United States,2006.0,259095,Finance,Investment Managers,9341870080.0,0.00023019975987187795,611
ALB,Albemarle Corporation Common Stock,$144.48,-4.95,-3.313%,16955200739.0,United States,,2834111,Industrials,Major Chemicals,9284740096.0,0.00022879197872252975,612
AYI,Acuity Brands Inc. ,$204.83,-0.28,-0.137%,6339035621.0,United States,,191808,Consumer Discretionary,Building Products,9259926528.0,0.0002281805296929191,613
BIRK,Birkenstock Holding plc Ordinary Shares,$48.73,-0.77,-1.556%,9152741098.0,,2023.0,481823,,,9233673216.0,0.00022753360289277233,614
MUSA,Murphy USA Inc. Common Stock,$356.56,0.76,0.214%,7586538173.0,United States,2013.0,124100,Consumer Discretionary,Retail-Auto Dealers and Gas Stations,9207451648.0,0.00022688745831942966,615
G,Genpact Limited Common Stock,$34.71,0.1,0.289%,6296824369.0,Bermuda,2007.0,1132392,Consumer Discretionary,Professional Services,9204687872.0,0.00022681935412122403,616
CR,Crane Company Common Stock,$118.14,-0.19,-0.161%,6712104016.0,United States,2023.0,243262,Industrials,Metal Fabrications,9193764864.0,0.0002265501924012316,617
HIMS,Hims & Hers Health Inc. Class A Common Stock,$8.90,-0.13,-1.44%,1886742221.0,United States,2019.0,1844233,Health Care,Medical/Nursing Services,9184342016.0,0.00022631799720601548,618
SKX,Skechers U.S.A. Inc. Common Stock,$62.34,-0.22,-0.352%,9599191998.0,United States,1999.0,546217,Consumer Discretionary,Shoe Manufacturing,9177587712.0,0.00022615155952859258,619
OGE,OGE Energy Corp Common Stock,$34.93,-0.01,-0.029%,6996037625.0,United States,,1456021,Utilities,Electric Utilities: Central,9081877504.0,0.00022379309524786395,620
LAD,Lithia Motors Inc. Common Stock,$329.28,0.14,0.043%,9061633473.0,United States,,232747,Consumer Discretionary,Retail-Auto Dealers and Gas Stations,9056031744.0,0.00022315621123055742,621
BRBR,BellRing Brands Inc. Common Stock ,$55.43,-0.36,-0.645%,7266001142.0,United States,2022.0,642181,Consumer Staples,Packaged Foods,9037537280.0,0.00022270047580121615,622
FRT,Federal Realty Investment Trust Common Stock,$103.05,-2.28,-2.165%,8411266947.0,United States,,388729,Real Estate,Real Estate Investment Trusts,8974918656.0,0.00022115744511411978,623
BLD,TopBuild Corp. Common Stock,$374.26,-3.29,-0.871%,11891716281.0,United States,2015.0,106284,Consumer Discretionary,Engineering & Construction,8954924032.0,0.0002206647431600022,624
MLI,Mueller Industries Inc. Common Stock,$47.15,-0.6,-1.257%,5352911682.0,United States,,390769,Industrials,Metal Fabrications,8925518848.0,0.0002199401488081411,625
X,United States Steel Corporation Common Stock,$48.65,-0.01,-0.021%,10850823025.0,United States,,3616738,Industrials,Steel/Iron Ore,8819496960.0,0.0002173275869816804,626
WF,Woori Financial Group Inc. American Depositary Shares (each representing three (3) shares of Common Stock),$30.22,-0.41,-1.339%,7333973187.0,South Korea,,25640,Finance,Commercial Banks,8787899392.0,0.00021654896851408818,627
RZB,Reinsurance Group of America Incorporated 5.75% Fixed-To-Floating Rate Subordinated Debentures due 2056,$25.28,-0.35,-1.366%,1666097739.0,United States,2016.0,51428,Finance,Life Insurance,8787475456.0,0.0002165385220012845,628
RRC,Range Resources Corporation Common Stock,$30.44,-0.39,-1.265%,7345320608.0,United States,,1600543,Energy,Oil & Gas Production,8784449536.0,0.00021646395812366403,629
CHE,Chemed Corp,$584.75,0.43,0.074%,8807684603.0,United States,,81935,Health Care,Medical/Nursing Services,8781601792.0,0.0002163937848093958,630
KD,Kyndryl Holdings Inc. Common Stock,$20.78,-0.34,-1.61%,4768259821.0,United States,2021.0,1226491,Technology,EDP Services,8779544576.0,0.00021634309146586299,631
WCC,WESCO International Inc. Common Stock,$173.88,-3.19,-1.802%,8881088620.0,United States,1999.0,245899,Consumer Discretionary,Telecommunications Equipment,8774478848.0,0.0002162182632077958,632
CFR,Cullen/Frost Bankers Inc. Common Stock,$108.49,-1.24,-1.13%,6948479643.0,United States,,256176,Finance,Major Banks,8764223488.0,0.00021596555348381305,633
ALK,Alaska Air Group Inc. Common Stock,$39.07,-0.85,-2.129%,5003033718.0,United States,,2093800,Consumer Discretionary,Air Freight/Delivery Services,8747153408.0,0.00021554491732816723,634
ERJ,Embraer S.A. Common Stock,$18.45,-0.12,-0.646%,3388493827.0,Brazil,2000.0,325918,Industrials,Aerospace,8723755008.0,0.00021496834047414763,635
PAAS,Pan American Silver Corp. Common Stock,$16.33,-0.21,-1.27%,5951305200.0,Canada,,3209773,,,8720463872.0,0.0002148872412177442,636
FOUR,Shift4 Payments Inc. Class A Common Stock,$74.34,-0.37,-0.495%,6128173742.0,United States,2020.0,573505,Technology,EDP Services,8687054848.0,0.00021406398535607051,637
WMS,Advanced Drainage Systems Inc. Common Stock,$140.64,-1.91,-1.34%,10956958055.0,United States,2014.0,283873,Consumer Discretionary,Containers/Packaging,8668196864.0,0.00021359929216816572,638
AA,Alcoa Corporation Common Stock ,$34.00,-0.55,-1.592%,6068044872.0,United States,2016.0,3294295,Industrials,Aluminum,8654492672.0,0.0002132615972868815,639
RRX,Regal Rexnord Corporation Common Stock,$148.02,-1.48,-0.99%,9821039076.0,United States,1976.0,188103,,,8610916352.0,0.0002121878017497785,640
ALSN,Allison Transmission Holdings Inc. Common Stock,$58.15,-0.25,-0.428%,5203536003.0,United States,2012.0,381941,Consumer Discretionary,Auto Parts:O.E.M.,8591168512.0,0.00021170118097823504,641
SKM,SK Telecom Co. Ltd. Common Stock,$21.40,-0.04,-0.187%,4683029282.0,South Korea,,272054,Telecommunications,Telecommunications Equipment,8530797056.0,0.000210213524378935,642
VNO,Vornado Realty Trust Common Stock,$28.25,-1.14,-3.879%,5376589607.0,United States,,3256106,Real Estate,Real Estate Investment Trusts,8522341888.0,0.00021000517448468381,643
KT,KT Corporation Common Stock,$13.44,-0.13,-0.958%,6882427185.0,South Korea,,863441,Telecommunications,Telecommunications Equipment,8461571072.0,0.00020850767696752522,644
BRX,Brixmor Property Group Inc. Common Stock,$23.27,-0.4,-1.69%,6994878088.0,United States,2013.0,2073815,Real Estate,Real Estate Investment Trusts,8443723264.0,0.000208067876255178,645
CRL,Charles River Laboratories International Inc. Common Stock,$236.40,-2.38,-0.997%,12126564466.0,United States,2000.0,226542,Health Care,Biotechnology: Commercial Physical & Biological Resarch,8432227328.0,0.00020778459660302697,646
WH,Wyndham Hotels & Resorts Inc. Common Stock ,$80.41,-0.45,-0.557%,6670966942.0,United States,2018.0,484620,Consumer Discretionary,Hotels/Resorts,8404332032.0,0.00020709720849060794,647
INGR,Ingredion Incorporated Common Stock,$108.53,-0.32,-0.294%,7075338552.0,United States,,252506,Consumer Staples,Packaged Foods,8358287872.0,0.0002059626011277637,648
CMA,Comerica Incorporated Common Stock,$55.81,-0.76,-1.343%,7359821638.0,United States,,1465531,Finance,Major Banks,8347356160.0,0.00020569322492622818,649
BERY,Berry Global Group Inc. Common Stock,$67.39,-0.72,-1.057%,7783545000.0,United States,2012.0,519906,Industrials,Plastic Products,8302859776.0,0.00020459675742836648,650
QGEN,Qiagen N.V. Common Shares ,$43.43,-0.14,-0.321%,9889879600.0,Netherlands,,496774,Health Care,Biotechnology: Biological Products (No Diagnostic Substances),8298816512.0,0.00020449712444332944,651
VIPS,Vipshop Holdings Limited American Depositary Shares each representing two ordinary shares,$17.76,0.22,1.254%,10405733894.0,China,2012.0,3163965,Consumer Discretionary,Catalog/Specialty Distribution,8295093248.0,0.0002044053768091406,652
GIL,Gildan Activewear Inc. Class A Sub. Vot. Common Stock,$33.06,-0.1,-0.302%,5752076340.0,Canada,2000.0,990178,Consumer Discretionary,Apparel,8224037376.0,0.00020265443780744053,653
ASR,Grupo Aeroportuario del Sureste S.A. de C.V. Common Stock,$294.27,2.22,0.76%,8828100000.0,Mexico,,27331,Consumer Discretionary,Aerospace,8152152064.0,0.00020088305997634193,654
GNRC,Generac Holdlings Inc. Common Stock,$129.24,-1.69,-1.291%,7939417011.0,United States,2010.0,479164,Consumer Discretionary,Metal Fabrications,8121811456.0,0.0002001354151668814,655
ATI,ATI Inc. Common Stock,$45.47,-0.81,-1.75%,5800935830.0,United States,,782695,Industrials,Steel/Iron Ore,8090724352.0,0.00019936937541096219,656
DCI,Donaldson Company Inc. Common Stock,$65.35,-0.2,-0.305%,7850869498.0,United States,,262496,Industrials,Pollution Control Equipment,8071935488.0,0.0001989063854588406,657
TTC,Toro Company (The) Common Stock,$95.99,-0.86,-0.888%,9970885514.0,United States,,565808,Consumer Discretionary,Tools/Hardware,8043036160.0,0.0001981942562696003,658
TAL,TAL Education Group American Depositary Shares,$12.63,0.83,7.034%,8044667979.0,China,,9546666,Real Estate,Other Consumer Services,8012792832.0,0.0001974490086067976,659
MOS,Mosaic Company (The) Common Stock,$35.73,-0.38,-1.052%,11677830807.0,United States,,2500845,Industrials,Agricultural Chemicals,7969713152.0,0.00019638745113421098,660
FBIN,Fortune Brands Innovations Inc. Common Stock,$76.14,-0.75,-0.975%,9600870483.0,United States,,814895,Basic Materials,Forest Products,7963827712.0,0.0001962424237614111,661
ICL,ICL Group Ltd. Ordinary Shares,$5.01,0.01,0.20%,6462900000.0,Israel,2014.0,576002,Industrials,Agricultural Chemicals,7939157504.0,0.00019563450736898047,662
KNX,Knight-Swift Transportation Holdings Inc.,$57.65,-0.76,-1.301%,9302922850.0,United States,2017.0,813628,Industrials,Trucking Freight/Courier Services,7933584384.0,0.0001954971760986084,663
ADC,Agree Realty Corporation Common Stock,$62.95,-0.52,-0.819%,6327716185.0,United States,,749593,Real Estate,Real Estate Investment Trusts,7928749568.0,0.00019537803790971328,664
EDU,New Oriental Education & Technology Group Inc. Sponsored ADR representing 10 Ordinary Share (Cayman Islands),$73.28,2.64,3.737%,12128750797.0,China,2006.0,1941601,Real Estate,Other Consumer Services,7920359424.0,0.00019517129031875442,665
SUN,Sunoco LP Common Units representing limited partner interests,$59.93,-2.52,-4.035%,6021519428.0,United States,2012.0,381269,Energy,Integrated oil Companies,7907137536.0,0.0001948454802382686,666
NNN,NNN REIT Inc. Common Stock,$43.10,-0.31,-0.714%,7863184300.0,United States,,1497557,Real Estate,Real Estate Investment Trusts,7905358848.0,0.00019480165030411403,667
GPK,Graphic Packaging Holding Company,$24.65,-0.15,-0.605%,7544203122.0,United States,,1692827,Consumer Discretionary,Containers/Packaging,7886622208.0,0.00019433994724125087,668
NYT,New York Times Company (The) Common Stock,$48.99,0.46,0.948%,8054303976.0,United States,,1611685,Consumer Discretionary,Newspapers/Magazines,7850117632.0,0.00019344041164961215,669
CAE,CAE Inc. Ordinary Shares,$21.59,-0.03,-0.139%,6871461347.0,Canada,,143859,Miscellaneous,Industrial Machinery/Components,7814528000.0,0.0001925634218531186,670
DLB,Dolby Laboratories Common Stock,$86.18,-0.71,-0.817%,10202027181.0,United States,2005.0,314239,Technology,EDP Services,7813292032.0,0.00019253296547400256,671
AXTA,Axalta Coating Systems Ltd. Common Shares,$33.97,-0.28,-0.818%,7476220835.0,United States,2014.0,946865,Consumer Discretionary,Paints/Coatings,7811701248.0,0.00019249376581786603,672
GTLS,Chart Industries Inc. Common Stock,$136.33,-3.07,-2.202%,5828192434.0,United States,2006.0,413705,Industrials,Metal Fabrications,7802322944.0,0.00019226266826348799,673
AXS,Axis Capital Holdings Limited Common Stock,$55.37,0.23,0.417%,4719831157.0,Bermuda,2003.0,468991,Finance,Property-Casualty Insurers,7778133504.0,0.00019166659882217168,674
BBWI,Bath & Body Works Inc.,$43.16,0.03,0.07%,9751595951.0,United States,,2367700,Consumer Discretionary,Clothing/Shoe/Accessory Stores,7766630400.0,0.00019138314253816163,675
AM,Antero Midstream Corporation Common Stock,$12.53,-0.07,-0.556%,6010803890.0,United States,2017.0,1348348,Utilities,Natural Gas Distribution,7762989056.0,0.00019129341355378994,676
OBDC,Blue Owl Capital Corporation Common Stock,$14.76,-0.09,-0.606%,5752457132.0,,2019.0,1641493,Finance,Diversified Financial Services,7754672640.0,0.0001910884827476665,677
FR,First Industrial Realty Trust Inc. Common Stock,$52.67,-0.62,-1.163%,6966922828.0,United States,1994.0,1222841,Real Estate,Real Estate Investment Trusts,7751274496.0,0.00019100474662993942,678
PLNT,Planet Fitness Inc. Common Stock,$73.00,-0.5,-0.68%,6434724576.0,United States,2015.0,681069,Consumer Discretionary,Hotels/Resorts,7737327104.0,0.00019066105888201058,679
IVZ,Invesco Ltd Common Stock,$17.84,-0.23,-1.273%,8020050478.0,United States,,2261289,Finance,Investment Managers,7703229952.0,0.00018982084636187297,680
BIO,Bio-Rad Laboratories Inc. Class A Common Stock,$322.89,-1.73,-0.533%,9410683941.0,United States,1980.0,119023,Industrials,Biotechnology: Laboratory Analytical Instruments,7675963392.0,0.0001891489513868005,681
TFII,TFI International Inc. Common Shares,$135.98,0.19,0.14%,11684992566.0,Canada,,256736,Industrials,Trucking Freight/Courier Services,7581774336.0,0.0001868279709098638,682
BXSL,Blackstone Secured Lending Fund Common Shares of Beneficial Interest,$27.64,-0.09,-0.325%,0.0,,2021.0,948260,Finance,Trusts Except Educational Religious and Charitable,7547643904.0,0.00018598693831323797,683
CACI,CACI International Inc. Class A Common Stock,$323.86,1.82,0.565%,7214963120.0,United States,,114103,Technology,EDP Services,7524724224.0,0.00018542215794408728,684
ESAB,ESAB Corporation Common Stock,$86.62,-0.87,-0.994%,5220680257.0,United States,2022.0,124909,Industrials,Office Equipment/Supplies/Services,7513588736.0,0.00018514776035113165,685
ALV,Autoliv Inc. Common Stock,$110.19,-0.9,-0.81%,9272304703.0,Sweden,,358120,Consumer Discretionary,Auto Parts:O.E.M.,7507210752.0,0.00018499059584630622,686
CWAN,Clearwater Analytics Holdings Inc. Class A Common Stock,$20.03,-0.07,-0.348%,4884494087.0,United States,2021.0,738024,Technology,Computer Software: Prepackaged Software,7486155264.0,0.00018447175237705675,687
EXP,Eagle Materials Inc Common Stock,$202.84,-1.4,-0.685%,7076456565.0,United States,,105451,Industrials,Building Materials,7465742848.0,0.00018396875530887177,688
BFAM,Bright Horizons Family Solutions Inc. Common Stock,$94.24,-1.42,-1.484%,5456958341.0,United States,2013.0,210820,Consumer Discretionary,Other Consumer Services,7388684288.0,0.00018206989974182104,689
AES,The AES Corporation Common Stock,$19.25,-0.1,-0.517%,12890358924.0,United States,,3749560,Utilities,Electric Utilities: Central,7380460544.0,0.00018186725253330324,690
LW,Lamb Weston Holdings Inc. Common Stock ,$108.09,-0.04,-0.037%,15665164943.0,United States,2016.0,925608,Consumer Staples,Packaged Foods,7343158272.0,0.00018094806033907017,691
PB,Prosperity Bancshares Inc. Common Stock,$67.73,-0.82,-1.196%,6347313834.0,United States,,345725,Finance,Major Banks,7308545024.0,0.00018009513032508462,692
MHK,Mohawk Industries Inc. Common Stock,$103.50,-1.37,-1.306%,6591103146.0,United States,,546546,Consumer Discretionary,Home Furnishings,7288905216.0,0.0001796111716479875,693
AGCO,AGCO Corporation Common Stock,$121.41,-0.7,-0.573%,9091173151.0,United States,,346619,Industrials,Industrial Machinery/Components,7265032704.0,0.00017902291185815125,694
ADT,ADT Inc. Common Stock,$6.82,-0.02,-0.292%,6286821136.0,United States,2018.0,2493849,Consumer Discretionary,Diversified Commercial Services,7235025408.0,0.00017828348043013418,695
SNV,Synovus Financial Corp. Common Stock,$37.65,-0.33,-0.869%,5506007159.0,United States,,1322814,Finance,Major Banks,7220817408.0,0.00017793337085247456,696
ONTO,Onto Innovation Inc. Common Stock,$152.90,-2.39,-1.539%,7504483830.0,United States,,197130,Technology,Semiconductors,7172277760.0,0.00017673727036957582,697
FLS,Flowserve Corporation Common Stock,$41.22,-0.33,-0.794%,5408419770.0,United States,,416132,Industrials,Fluid Controls,7165610496.0,0.00017657297750758361,698
HRB,H&R Block Inc. Common Stock,$48.37,-0.56,-1.144%,6961946533.0,United States,,935367,Consumer Discretionary,Other Consumer Services,7140844032.0,0.00017596268920161786,699
UGI,UGI Corporation Common Stock,$24.60,-0.14,-0.566%,5188129742.0,United States,,1291047,Utilities,Natural Gas Distribution,7138235392.0,0.00017589840782150342,700
WTS,Watts Water Technologies Inc. Class A Common Stock,$208.34,-2.8,-1.326%,6943189883.0,United States,1986.0,125532,Industrials,Metal Fabrications,7072129536.0,0.00017426944573500382,701
AN,AutoNation Inc. Common Stock,$150.18,-1.32,-0.871%,6385724034.0,United States,,281576,Consumer Discretionary,Retail-Auto Dealers and Gas Stations,7061042688.0,0.00017399624671537712,702
FN,Fabrinet Ordinary Shares,$190.33,-6.58,-3.342%,6914852203.0,Cayman Islands,2010.0,296974,Utilities,Telecommunications Equipment,7025889792.0,0.00017313001884572117,703
STWD,STARWOOD PROPERTY TRUST INC. Starwood Property Trust Inc.,$21.02,-0.3,-1.407%,6584011529.0,United States,2009.0,1919981,Real Estate,Real Estate Investment Trusts,6998019584.0,0.00017244324894480863,704
RLI,RLI Corp. Common Stock (DE),$133.12,0.51,0.385%,6073702636.0,United States,,136665,Finance,Property-Casualty Insurers,6953883136.0,0.00017135565088958096,705
LPX,Louisiana-Pacific Corporation Common Stock,$70.83,-0.64,-0.895%,5107884413.0,United States,,332861,Basic Materials,Forest Products,6935060480.0,0.0001708918282444098,706
PDI,PIMCO Dynamic Income Fund Common Stock,$17.95,0.14,0.786%,4363465500.0,United States,2012.0,1823989,Finance,Trusts Except Educational Religious and Charitable,6924931072.0,0.00017064222219452088,707
LEVI,Levi Strauss & Co Class A Common Stock,$16.54,-0.17,-1.017%,6568610799.0,United States,2019.0,987054,Consumer Discretionary,Apparel,6923958272.0,0.00017061825072794238,708
TIMB,TIM S.A. American Depositary Shares (Each representing 5 Common Shares) ,$18.47,-0.01,-0.054%,8942451823.0,Brazil,2020.0,196852,Telecommunications,Telecommunications Equipment,6912040960.0,0.00017032458764579446,709
EAT,Brinker International Inc. Common Stock,$43.18,-0.68,-1.55%,1908689988.0,United States,,812474,Consumer Discretionary,Restaurants,6905716736.0,0.0001701687478799115,710
SSD,Simpson Manufacturing Company Inc. Common Stock,$197.98,-2.93,-1.458%,8448384900.0,United States,,167273,Consumer Discretionary,Industrial Machinery/Components,6898046976.0,0.00016997975179078211,711
VMI,Valmont Industries Inc. Common Stock,$233.51,-0.59,-0.252%,4878166108.0,United States,,136285,Industrials,Metal Fabrications,6870995968.0,0.00016931316838804096,712
HII,Huntington Ingalls Industries Inc. Common Stock,$259.64,1.17,0.453%,10313798116.0,United States,,168180,Industrials,Marine Transportation,6819611136.0,0.0001680469576736808,713
STAG,Stag Industrial Inc. Common Stock,$39.26,-0.32,-0.808%,7128473613.0,United States,2011.0,1511372,Real Estate,Real Estate Investment Trusts,6785513984.0,0.00016720674515354318,714
PATH,UiPath Inc. Class A Common Stock,$24.84,-0.68,-2.665%,14061383954.0,United States,2021.0,6340858,Technology,Computer Software: Prepackaged Software,6760067584.0,0.00016657970205409518,715
TRNO,Terreno Realty Corporation Common Stock,$62.67,-0.97,-1.524%,5351134666.0,United States,2010.0,383088,Finance,Real Estate,6737174528.0,0.00016601557774613505,716
VOYA,Voya Financial Inc. Common Stock,$72.96,-0.23,-0.314%,7621985353.0,United States,2013.0,609322,Finance,Life Insurance,6734604288.0,0.0001659522426081224,717
R,Ryder System Inc. Common Stock,$115.06,-0.21,-0.182%,5099717280.0,United States,,337069,Consumer Discretionary,Rental/Leasing Companies,6718433280.0,0.00016555376113421965,718
CHH,Choice Hotels International Inc. Common Stock,$113.30,0.35,0.31%,5642179794.0,United States,,405917,Consumer Discretionary,Hotels/Resorts,6694734848.0,0.0001649697909752448,719
GKOS,Glaukos Corporation Common Stock,$79.49,-0.93,-1.156%,3879078694.0,United States,2015.0,459878,Health Care,Medical/Dental Instruments,6693620736.0,0.00016494233733773176,720
SPXC,SPX Technologies Inc. Common Stock,$101.01,-1.26,-1.232%,4610916500.0,United States,,184724,Industrials,Industrial Machinery/Components,6676297216.0,0.00016451545598421418,721
NFG,National Fuel Gas Company Common Stock,$50.17,0.05,0.10%,4607090430.0,United States,,499474,Utilities,Oil/Gas Transmission,6659208704.0,0.00016409436563235953,722
